tool_name,blurb
1Password,"1Password secures all your passwords with end-to-end encryption and autofills them across all your devices."
Bitwarden,"Bitwarden offers open-source password management, multi-device sync, and secure sharing at an unbeatable price."
Dashlane,"Dashlane simplifies your digital life with automatic password capture, password health reports, and one-click logins."
DocuSign,"DocuSign lets you sign legally binding documents online in seconds, with a full audit trail and mobile support."
Adobe Sign,"Adobe Sign integrates seamlessly with other Adobe apps to create, send, and track e-signatures in minutes."
SignRequest,"SignRequest offers an easy-to-use interface for legally binding e-signatures at a lower cost than most competitors."
HubSpot CRM,"HubSpot CRM is a free, user-friendly CRM with powerful marketing, sales, and customer service automation."
Zoho CRM,"Zoho CRM provides multichannel support, lead scoring, and AI-powered sales predictions in one affordable platform."
Pipedrive,"Pipedrive streamlines your sales pipeline with intuitive drag-and-drop management and insightful analytics."
Mailchimp,"Mailchimp’s drag-and-drop email builder and advanced segmentation tools help you run smarter campaigns."
Sendinblue,"Sendinblue offers email marketing, SMS campaigns, and chat—all in one platform with no monthly send limits."
ActiveCampaign,"ActiveCampaign combines email marketing, automation, and CRM features for personalized customer experiences."
Freshdesk,"Freshdesk centralizes all your support channels into one ticketing system with AI-driven automation."
Zendesk,"Zendesk is a scalable helpdesk solution with multichannel support, self-service portals, and analytics."
Help Scout,"Help Scout feels like email but acts like a helpdesk, with a shared inbox, docs, and customer data in one place."
Asana,"Asana’s timeline and board views help teams plan, organize, and track work from start to finish."
Trello,"Trello’s card-and-board interface makes task management visual, simple, and highly customizable."
Monday.com,"Monday.com offers a flexible Work OS to manage projects, workflows, and everyday work in one place."
FreshBooks,"FreshBooks automates invoicing, expense tracking, and time logging, so freelancers can get paid faster."
QuickBooks,"QuickBooks delivers comprehensive accounting, payroll, and tax tools trusted by millions of small businesses."
Zoho Invoice,"Zoho Invoice lets you create and send professional invoices quickly, with automated payment reminders."
BambooHR,"BambooHR streamlines employee data, time-off requests, and performance management in an intuitive interface."
Workday,"Workday provides enterprise-grade HR, payroll, and talent management on a unified cloud platform."
Zoho People,"Zoho People offers custom workflows, attendance tracking, and performance reviews—all in one HR system."
NordVPN,"NordVPN secures your internet connection with military-grade encryption and a global server network."
ExpressVPN,"ExpressVPN offers lightning-fast speeds, strong privacy protections, and easy-to-use apps across devices."
CyberGhost,"CyberGhost gives you anonymous browsing with specialized servers for streaming, torrenting, and gaming."
Google Drive,"Google Drive provides seamless file syncing, sharing, and collaboration across Google Workspace apps."
Dropbox,"Dropbox syncs files across devices, offers powerful sharing controls, and integrates with hundreds of apps."
OneDrive,"OneDrive combines personal cloud storage with Microsoft 365 integration for easy file access anywhere."
